{
  "ready": true,
  "commit": {
    "type": "feat",
    "scope": "focus-garden",
    "message": "Implement Focus Garden MVP",
    "body": [
      "Added single-page app layout with Vite (Vanilla JS)",
      "Implemented timer logic for focus sessions",
      "Added LocalStorage persistence for garden data",
      "Applied premium design with animations and gradients"
    ]
  },
  "changed_files": [
    "focus-garden/index.html",
    "focus-garden/src/style.css",
    "focus-garden/src/main.js",
    "focus-garden/package.json"
  ],
  "summary": [
    "Built Focus Garden MVP as a single-page app.",
    "Integrated LocalStorage persistence.",
    "Fully satisfied the US-001.md requirements."
  ],
  "verification": {
    "status": "passed",
    "source": ".coding/VERIFY.md"
  },
  "notes": [
    "The Vite project was created in `focus-garden/` folder."
  ]
}
