{
  "ready": true,
  "commit": {
    "type": "feat",
    "scope": "docs",
    "message": "add copy button to code blocks",
    "body": [
      "Add a lightweight copy interaction for documentation code blocks.",
      "Record verification in .coding/VERIFY.md."
    ]
  },
  "changed_files": [
    "src/components/CodeBlock.tsx",
    ".coding/REQUEST.md",
    ".coding/PLAN.md",
    ".coding/VERIFY.md",
    ".coding/SHIP.md"
  ],
  "summary": [
    "Added code block copy UX.",
    "Verified copy behavior and basic regression coverage."
  ],
  "verification": {
    "status": "passed",
    "source": ".coding/VERIFY.md"
  },
  "notes": []
}
